{
  "schemaVersion": 1,
  "recordType": "developer-service-account",
  "accountRef": "example-service:account-01",
  "provider": "example-service",
  "displayName": "Example Service Account",
  "owner": "repository owner",
  "plan": {
    "name": "project-selected",
    "quotaPolicy": "Follow the selected provider terms and project policy; never switch accounts automatically to evade limits."
  },
  "identity": {
    "organizationId": "<non-secret-provider-id>",
    "loginLandmark": "<masked-login-or-provider-landmark>"
  },
  "login": {
    "profileRef": "<password-manager-or-browser-profile-reference>",
    "notes": "Never store passwords, cookies, OAuth tokens, or recovery codes here."
  },
  "automationProfiles": [
    {
      "profileId": "example-service:account-01:readonly",
      "method": "dashboard-only",
      "toolName": "example-service",
      "credentialRef": "<approved-credential-profile-reference>",
      "defaultMode": "read-only",
      "writesRequireExplicitApproval": true,
      "expectedIdentity": {
        "organizationId": "<non-secret-provider-id>"
      },
      "status": "planned",
      "lastVerified": null
    }
  ],
  "status": "draft",
  "lastVerified": null
}
